id,published_at,title,description,body,categories,industries,entities,topics,language,sentiment_overall_score,sentiment_overall_polarity,sentiment_title_score,sentiment_title_polarity,sentiment_body_score,sentiment_body_polarity,summary
3021039473,2024-12-31T10:12:06Z,Lagu ‘Apa Sih’ Radja Hilang di Spotify Imbas Isu Plagiat ‘APT. ’ Rose...[Upgrade subscription plan],Lagu ‘Apa Sih’ Radja Hilang di Spotify Imbas Isu Plagiat ‘APT. ’. . ....[Upgrade subscription plan],Lagu ‘Apa Sih’ Radja Hilang di Spotify Imbas Isu Plagiat ‘APT. ’ Rose PENGATURAN KELUAR HOT GOSSIP KOREA FOOD & TRAVEL LIFESTYLE I-PEDIA ZODIAC ROYAL FAMILY FASHION & BEAUTY FILM & MUSIK LIRIK LAGU VI...[+1472 chars]...[Upgrade subscription plan],"[{""id"": ""IAB17-9"", ""name"": ""Cricket"", ""score"": 0.2, ""taxonomy"": ""iab-qag"", ""links"": {""self"": ""https://api.apitube.io/v1/news/category/iab-qag/IAB17-9""}}, {""id"": ""IAB20"", ""name"": ""Travel"", ""score"": 0.2, ""taxonomy"": ""iab-qag"", ""links"": {""self"": ""https://api.apitube.io/v1/news/category/iab-qag/IAB20""}}, {""id"": ""IAB19-31"", ""name"": ""Unix"", ""score"": 0.2, ""taxonomy"": ""iab-qag"", ""links"": {""self"": ""https://api.apitube.io/v1/news/category/iab-qag/IAB19-31""}}, {""id"": ""IAB19-18"", ""name"": ""Internet Technology"", ""score"": 0.2, ""taxonomy"": ""iab-qag"", ""links"": {""self"": ""https://api.apitube.io/v1/news/category/iab-qag/IAB19-18""}}, {""id"": ""IAB7-25"", ""name"": ""Herbs for Health"", ""score"": 0.2, ""taxonomy"": ""iab-qag"", ""links"": {""self"": ""https://api.apitube.io/v1/news/category/iab-qag/IAB7-25""}}, {""id"": ""IAB19-34"", ""name"": ""Web Design/HTML"", ""score"": 0.2, ""taxonomy"": ""iab-qag"", ""links"": {""self"": ""https://api.apitube.io/v1/news/category/iab-qag/IAB19-34""}}, {""id"": ""IAB11-3"", ""name"": ""U.S. Government Resources"", ""score"": 0.2, ""taxonomy"": ""iab-qag"", ""links"": {""self"": ""https://api.apitube.io/v1/news/category/iab-qag/IAB11-3""}}, {""id"": ""IAB4-6"", ""name"": ""Resume Writing/Advice"", ""score"": 0.1, ""taxonomy"": ""iab-qag"", ""links"": {""self"": ""https://api.apitube.io/v1/news/category/iab-qag/IAB4-6""}}]","[{""id"": 34, ""name"": ""Security cameras for"", ""links"": {""self"": ""https://api.apitube.io/v1/news/industry/34""}}, {""id"": 1219, ""name"": ""Travel"", ""links"": {""self"": ""https://api.apitube.io/v1/news/industry/1219""}}, {""id"": 142, ""name"": ""Broadcast Tech"", ""links"": {""self"": ""https://api.apitube.io/v1/news/industry/142""}}]",,,en,0.05,neutral,0.06,positive,0.03,positive,"' Rose miu | Insertlive Selasa, 31 Dec 2024 17:00 WIB Jakarta, Insertlive - Lagu 'Apa Sih' Radja sudah tak bisa lagi diputar di platform musik Spotify. Rabu, 14 Oct 2020 20:10 WIB Sepi Job, Band Radja Jual Kacamata Ikonik Ian Kasela demi Sambung Hidup Jumat, 09 Oct 2020 08:00 WIB UPCOMING EVENTS Lebih lanjut detikNetwork BACA JUGA VIDEO TERKAIT Loading POPULER part of Copyright @ 2024 | InsertLive. All Rights Reserved Kategori Playlist Hot Gossip Korea Lifestyle Film & Music Sorot Foto Video Infografis Layanan berbuatbaik. id Pasang Mata Adsmart detikEvent detikPoint Trans Snow World Trans Studio Informasi Tentang Kami Pedoman Siber Disclaimer Privacy Policy Jaringan Media detikcom CNN Indonesia CNBC Indonesia HaiBunda Beautynesia Female Daily CXO Media"
3021039509,2024-12-31T10:12:03Z,Lagu ‘Apa Sih’ Radja Hilang di Spotify Imbas Isu Plagiat ‘APT. ’ Rose...[Upgrade subscription plan],Lagu ‘Apa Sih’ Radja Hilang di Spotify Imbas Isu Plagiat ‘APT. ’. . ....[Upgrade subscription plan],Lagu ‘Apa Sih’ Radja Hilang di Spotify Imbas Isu Plagiat ‘APT. ’ Rose PENGATURAN KELUAR HOT GOSSIP KOREA FOOD & TRAVEL LIFESTYLE I-PEDIA ZODIAC ROYAL FAMILY FASHION & BEAUTY FILM & MUSIK LIRIK LAGU VI...[+1472 chars]...[Upgrade subscription plan],"[{""id"": ""IAB17-9"", ""name"": ""Cricket"", ""score"": 0.2, ""taxonomy"": ""iab-qag"", ""links"": {""self"": ""https://api.apitube.io/v1/news/category/iab-qag/IAB17-9""}}, {""id"": ""IAB20"", ""name"": ""Travel"", ""score"": 0.2, ""taxonomy"": ""iab-qag"", ""links"": {""self"": ""https://api.apitube.io/v1/news/category/iab-qag/IAB20""}}, {""id"": ""IAB19-31"", ""name"": ""Unix"", ""score"": 0.2, ""taxonomy"": ""iab-qag"", ""links"": {""self"": ""https://api.apitube.io/v1/news/category/iab-qag/IAB19-31""}}, {""id"": ""IAB19-18"", ""name"": ""Internet Technology"", ""score"": 0.2, ""taxonomy"": ""iab-qag"", ""links"": {""self"": ""https://api.apitube.io/v1/news/category/iab-qag/IAB19-18""}}, {""id"": ""IAB7-25"", ""name"": ""Herbs for Health"", ""score"": 0.2, ""taxonomy"": ""iab-qag"", ""links"": {""self"": ""https://api.apitube.io/v1/news/category/iab-qag/IAB7-25""}}, {""id"": ""IAB19-34"", ""name"": ""Web Design/HTML"", ""score"": 0.2, ""taxonomy"": ""iab-qag"", ""links"": {""self"": ""https://api.apitube.io/v1/news/category/iab-qag/IAB19-34""}}, {""id"": ""IAB11-3"", ""name"": ""U.S. Government Resources"", ""score"": 0.2, ""taxonomy"": ""iab-qag"", ""links"": {""self"": ""https://api.apitube.io/v1/news/category/iab-qag/IAB11-3""}}, {""id"": ""IAB4-6"", ""name"": ""Resume Writing/Advice"", ""score"": 0.1, ""taxonomy"": ""iab-qag"", ""links"": {""self"": ""https://api.apitube.io/v1/news/category/iab-qag/IAB4-6""}}]","[{""id"": 34, ""name"": ""Security cameras for"", ""links"": {""self"": ""https://api.apitube.io/v1/news/industry/34""}}, {""id"": 1219, ""name"": ""Travel"", ""links"": {""self"": ""https://api.apitube.io/v1/news/industry/1219""}}, {""id"": 142, ""name"": ""Broadcast Tech"", ""links"": {""self"": ""https://api.apitube.io/v1/news/industry/142""}}]",,,en,0.05,neutral,0.06,positive,0.03,positive,"' Rose miu | Insertlive Selasa, 31 Dec 2024 17:00 WIB Jakarta, Insertlive - Lagu 'Apa Sih' Radja sudah tak bisa lagi diputar di platform musik Spotify. Rabu, 14 Oct 2020 20:10 WIB Sepi Job, Band Radja Jual Kacamata Ikonik Ian Kasela demi Sambung Hidup Jumat, 09 Oct 2020 08:00 WIB UPCOMING EVENTS Lebih lanjut detikNetwork BACA JUGA VIDEO TERKAIT Loading POPULER part of Copyright @ 2024 | InsertLive. All Rights Reserved Kategori Playlist Hot Gossip Korea Lifestyle Film & Music Sorot Foto Video Infografis Layanan berbuatbaik. id Pasang Mata Adsmart detikEvent detikPoint Trans Snow World Trans Studio Informasi Tentang Kami Pedoman Siber Disclaimer Privacy Policy Jaringan Media detikcom CNN Indonesia CNBC Indonesia HaiBunda Beautynesia Female Daily CXO Media"
3021086535,2024-12-30T18:12:03Z,"Spotify, Italia regina di questi due generi musicali: niente di simile in tutta Europa - Player. it...[Upgrade subscription plan]","Spotify, Italia regina di questi due generi musicali: niente di simile in tutta Europa - Player. it Videogiochi PC Switch PS4 PS5 Xbox One Xbox Series. . ....[Upgrade subscription plan]","Spotify, Italia regina di questi due generi musicali: niente di simile in tutta Europa - Player. it Videogiochi PC Switch PS4 PS5 Xbox One Xbox Series X iOs Android Guide News Recensioni Boardgame GDR...[+4577 chars]...[Upgrade subscription plan]","[{""id"": ""IAB19-31"", ""name"": ""Unix"", ""score"": 0.6, ""taxonomy"": ""iab-qag"", ""links"": {""self"": ""https://api.apitube.io/v1/news/category/iab-qag/IAB19-31""}}, {""id"": ""IAB7-25"", ""name"": ""Herbs for Health"", ""score"": 0.4, ""taxonomy"": ""iab-qag"", ""links"": {""self"": ""https://api.apitube.io/v1/news/category/iab-qag/IAB7-25""}}, {""id"": ""IAB19-34"", ""name"": ""Web Design/HTML"", ""score"": 0.3, ""taxonomy"": ""iab-qag"", ""links"": {""self"": ""https://api.apitube.io/v1/news/category/iab-qag/IAB19-34""}}, {""id"": ""IAB13-6"", ""name"": ""Insurance"", ""score"": 0.3, ""taxonomy"": ""iab-qag"", ""links"": {""self"": ""https://api.apitube.io/v1/news/category/iab-qag/IAB13-6""}}, {""id"": ""IAB22-3"", ""name"": ""Comparison"", ""score"": 0.3, ""taxonomy"": ""iab-qag"", ""links"": {""self"": ""https://api.apitube.io/v1/news/category/iab-qag/IAB22-3""}}, {""id"": ""IAB19-10"", ""name"": ""Computer Reviews"", ""score"": 0.2, ""taxonomy"": ""iab-qag"", ""links"": {""self"": ""https://api.apitube.io/v1/news/category/iab-qag/IAB19-10""}}, {""id"": ""IAB1-4"", ""name"": ""Humor"", ""score"": 0.2, ""taxonomy"": ""iab-qag"", ""links"": {""self"": ""https://api.apitube.io/v1/news/category/iab-qag/IAB1-4""}}, {""id"": ""IAB15-2"", ""name"": ""Biology"", ""score"": 0.2, ""taxonomy"": ""iab-qag"", ""links"": {""self"": ""https://api.apitube.io/v1/news/category/iab-qag/IAB15-2""}}]","[{""id"": 849, ""name"": ""Electronic Devices Retail"", ""links"": {""self"": ""https://api.apitube.io/v1/news/industry/849""}}]",,,en,0,neutral,0,neutral,0.01,positive,"C’entrano anche la cultura specifica di ogni Paese, le politiche dell’industria musicale e come e quanto un certo tipo di musica riesce a rappresentare e rispecchiare i gusti comuni. Va detto che tali dati non possono però essere intesi come rappresentativi del vero gusto dominante in Italia, anche perché la stessa piattaforma di streaming tende a proporre tramite playlist e consigli brani legati a un determinato segmento di pubblico. Rap e hip-hop: i due generi più ascoltati in Italia secondo Spotify Ebbene, il rap e l’hip-hop come metacategoria hanno occupato il primo posto delle canzoni più riprodotte su Spotify. In Nord Europa, per esempio, in classifica rientrano ancora i brani rock e heavy, in abbinamento con i pezzi urban e pop. In Francia sono le canzoni pop riescono a convivere con il rap, la trap, il rock e l’alternative."
3021086575,2024-12-30T18:12:03Z,"Spotify, Italia regina di questi due generi musicali: niente di simile in tutta Europa - Player. it...[Upgrade subscription plan]","Spotify, Italia regina di questi due generi musicali: niente di simile in tutta Europa - Player. it Videogiochi PC Switch PS4 PS5 Xbox One Xbox Series. . ....[Upgrade subscription plan]","Spotify, Italia regina di questi due generi musicali: niente di simile in tutta Europa - Player. it Videogiochi PC Switch PS4 PS5 Xbox One Xbox Series X iOs Android Guide News Recensioni Boardgame GDR...[+4577 chars]...[Upgrade subscription plan]","[{""id"": ""IAB19-31"", ""name"": ""Unix"", ""score"": 0.6, ""taxonomy"": ""iab-qag"", ""links"": {""self"": ""https://api.apitube.io/v1/news/category/iab-qag/IAB19-31""}}, {""id"": ""IAB7-25"", ""name"": ""Herbs for Health"", ""score"": 0.4, ""taxonomy"": ""iab-qag"", ""links"": {""self"": ""https://api.apitube.io/v1/news/category/iab-qag/IAB7-25""}}, {""id"": ""IAB19-34"", ""name"": ""Web Design/HTML"", ""score"": 0.3, ""taxonomy"": ""iab-qag"", ""links"": {""self"": ""https://api.apitube.io/v1/news/category/iab-qag/IAB19-34""}}, {""id"": ""IAB13-6"", ""name"": ""Insurance"", ""score"": 0.3, ""taxonomy"": ""iab-qag"", ""links"": {""self"": ""https://api.apitube.io/v1/news/category/iab-qag/IAB13-6""}}, {""id"": ""IAB22-3"", ""name"": ""Comparison"", ""score"": 0.3, ""taxonomy"": ""iab-qag"", ""links"": {""self"": ""https://api.apitube.io/v1/news/category/iab-qag/IAB22-3""}}, {""id"": ""IAB19-10"", ""name"": ""Computer Reviews"", ""score"": 0.2, ""taxonomy"": ""iab-qag"", ""links"": {""self"": ""https://api.apitube.io/v1/news/category/iab-qag/IAB19-10""}}, {""id"": ""IAB1-4"", ""name"": ""Humor"", ""score"": 0.2, ""taxonomy"": ""iab-qag"", ""links"": {""self"": ""https://api.apitube.io/v1/news/category/iab-qag/IAB1-4""}}, {""id"": ""IAB15-2"", ""name"": ""Biology"", ""score"": 0.2, ""taxonomy"": ""iab-qag"", ""links"": {""self"": ""https://api.apitube.io/v1/news/category/iab-qag/IAB15-2""}}]","[{""id"": 849, ""name"": ""Electronic Devices Retail"", ""links"": {""self"": ""https://api.apitube.io/v1/news/industry/849""}}]",,,en,0,neutral,0,neutral,0.01,positive,"C’entrano anche la cultura specifica di ogni Paese, le politiche dell’industria musicale e come e quanto un certo tipo di musica riesce a rappresentare e rispecchiare i gusti comuni. Va detto che tali dati non possono però essere intesi come rappresentativi del vero gusto dominante in Italia, anche perché la stessa piattaforma di streaming tende a proporre tramite playlist e consigli brani legati a un determinato segmento di pubblico. Rap e hip-hop: i due generi più ascoltati in Italia secondo Spotify Ebbene, il rap e l’hip-hop come metacategoria hanno occupato il primo posto delle canzoni più riprodotte su Spotify. In Nord Europa, per esempio, in classifica rientrano ancora i brani rock e heavy, in abbinamento con i pezzi urban e pop. In Francia sono le canzoni pop riescono a convivere con il rap, la trap, il rock e l’alternative."
3021217068,2024-12-20T18:12:26Z,"The Spotify Partner Program Is Here, Offering New Ways for Creators to Monetize in the US, UK, Canada, and Australia — Spotify...[Upgrade subscription plan]","With more than 640 million users and more than 250 million subscribers, Spotify is one of the largest platforms in the world for creators. We’re also continuously building new offerings to help creato...[+173 chars]...[Upgrade subscription plan]","The Spotify Partner Program Is Here, Offering New Ways for Creators to Monetize in the US, UK, Canada, and Australia — Spotify News News & Announcements Artists & Creators Culture & Trends Behind the ...[+4063 chars]...[Upgrade subscription plan]","[{""id"": ""IAB3-1"", ""name"": ""Advertising"", ""score"": 0.6, ""taxonomy"": ""iab-qag"", ""links"": {""self"": ""https://api.apitube.io/v1/news/category/iab-qag/IAB3-1""}}, {""id"": ""IAB19-6"", ""name"": ""Cell Phones"", ""score"": 0.4, ""taxonomy"": ""iab-qag"", ""links"": {""self"": ""https://api.apitube.io/v1/news/category/iab-qag/IAB19-6""}}, {""id"": ""IAB19-14"", ""name"": ""Desktop Video"", ""score"": 0.4, ""taxonomy"": ""iab-qag"", ""links"": {""self"": ""https://api.apitube.io/v1/news/category/iab-qag/IAB19-14""}}, {""id"": ""IAB13-9"", ""name"": ""Options"", ""score"": 0.4, ""taxonomy"": ""iab-qag"", ""links"": {""self"": ""https://api.apitube.io/v1/news/category/iab-qag/IAB13-9""}}, {""id"": ""IAB19-34"", ""name"": ""Web Design/HTML"", ""score"": 0.4, ""taxonomy"": ""iab-qag"", ""links"": {""self"": ""https://api.apitube.io/v1/news/category/iab-qag/IAB19-34""}}, {""id"": ""IAB7-25"", ""name"": ""Herbs for Health"", ""score"": 0.4, ""taxonomy"": ""iab-qag"", ""links"": {""self"": ""https://api.apitube.io/v1/news/category/iab-qag/IAB7-25""}}, {""id"": ""IAB8"", ""name"": ""Food & Drink"", ""score"": 0.4, ""taxonomy"": ""iab-qag"", ""links"": {""self"": ""https://api.apitube.io/v1/news/category/iab-qag/IAB8""}}, {""id"": ""IAB9-6"", ""name"": ""Candle & Soap Making"", ""score"": 0.3, ""taxonomy"": ""iab-qag"", ""links"": {""self"": ""https://api.apitube.io/v1/news/category/iab-qag/IAB9-6""}}]","[{""id"": 649, ""name"": ""Press Media"", ""links"": {""self"": ""https://api.apitube.io/v1/news/industry/649""}}, {""id"": 1119, ""name"": ""Display Technology Evolution"", ""links"": {""self"": ""https://api.apitube.io/v1/news/industry/1119""}}, {""id"": 650, ""name"": ""News publications for advertising"", ""links"": {""self"": ""https://api.apitube.io/v1/news/industry/650""}}, {""id"": 34, ""name"": ""Security cameras for"", ""links"": {""self"": ""https://api.apitube.io/v1/news/industry/34""}}, {""id"": 368, ""name"": ""Biofuels"", ""links"": {""self"": ""https://api.apitube.io/v1/news/industry/368""}}, {""id"": 260, ""name"": ""Record Video"", ""links"": {""self"": ""https://api.apitube.io/v1/news/industry/260""}}, {""id"": 753, ""name"": ""Eco-Friendly Packaging Supports Sustainable"", ""links"": {""self"": ""https://api.apitube.io/v1/news/industry/753""}}, {""id"": 811, ""name"": ""Bus"", ""links"": {""self"": ""https://api.apitube.io/v1/news/industry/811""}}]",,,en,0.06,positive,0,neutral,0.13,positive,"We’re also continuously building new offerings to help creators grow their audiences and better monetize their content on Spotify. Today, we officially launched the Spotify Partner Program, a powerful new monetization system for creators in the U. This dual approach gives creators greater flexibility and control, helping them navigate industry shifts and maintain consistent revenue streams. Users, meanwhile, benefit from enhancements to the viewing experience and a bigger and better catalog of video podcasts, and Premium users are able to watch without interruptions from third-party ads. While a creator’s baked-in sponsorships will remain in episodes, traditional dynamic ads will not interrupt the video for Premium users, creating a seamless viewing experience on any device."
3021217190,2024-12-20T18:12:26Z,"The Spotify Partner Program Is Here, Offering New Ways for Creators to Monetize in the US, UK, Canada, and Australia — Spotify...[Upgrade subscription plan]","With more than 640 million users and more than 250 million subscribers, Spotify is one of the largest platforms in the world for creators. We’re also continuously building new offerings to help creato...[+173 chars]...[Upgrade subscription plan]","The Spotify Partner Program Is Here, Offering New Ways for Creators to Monetize in the US, UK, Canada, and Australia — Spotify News News & Announcements Artists & Creators Culture & Trends Behind the ...[+4063 chars]...[Upgrade subscription plan]","[{""id"": ""IAB3-1"", ""name"": ""Advertising"", ""score"": 0.6, ""taxonomy"": ""iab-qag"", ""links"": {""self"": ""https://api.apitube.io/v1/news/category/iab-qag/IAB3-1""}}, {""id"": ""IAB19-6"", ""name"": ""Cell Phones"", ""score"": 0.4, ""taxonomy"": ""iab-qag"", ""links"": {""self"": ""https://api.apitube.io/v1/news/category/iab-qag/IAB19-6""}}, {""id"": ""IAB19-14"", ""name"": ""Desktop Video"", ""score"": 0.4, ""taxonomy"": ""iab-qag"", ""links"": {""self"": ""https://api.apitube.io/v1/news/category/iab-qag/IAB19-14""}}, {""id"": ""IAB13-9"", ""name"": ""Options"", ""score"": 0.4, ""taxonomy"": ""iab-qag"", ""links"": {""self"": ""https://api.apitube.io/v1/news/category/iab-qag/IAB13-9""}}, {""id"": ""IAB19-34"", ""name"": ""Web Design/HTML"", ""score"": 0.4, ""taxonomy"": ""iab-qag"", ""links"": {""self"": ""https://api.apitube.io/v1/news/category/iab-qag/IAB19-34""}}, {""id"": ""IAB7-25"", ""name"": ""Herbs for Health"", ""score"": 0.4, ""taxonomy"": ""iab-qag"", ""links"": {""self"": ""https://api.apitube.io/v1/news/category/iab-qag/IAB7-25""}}, {""id"": ""IAB8"", ""name"": ""Food & Drink"", ""score"": 0.4, ""taxonomy"": ""iab-qag"", ""links"": {""self"": ""https://api.apitube.io/v1/news/category/iab-qag/IAB8""}}, {""id"": ""IAB9-6"", ""name"": ""Candle & Soap Making"", ""score"": 0.3, ""taxonomy"": ""iab-qag"", ""links"": {""self"": ""https://api.apitube.io/v1/news/category/iab-qag/IAB9-6""}}]","[{""id"": 649, ""name"": ""Press Media"", ""links"": {""self"": ""https://api.apitube.io/v1/news/industry/649""}}, {""id"": 1119, ""name"": ""Display Technology Evolution"", ""links"": {""self"": ""https://api.apitube.io/v1/news/industry/1119""}}, {""id"": 650, ""name"": ""News publications for advertising"", ""links"": {""self"": ""https://api.apitube.io/v1/news/industry/650""}}, {""id"": 34, ""name"": ""Security cameras for"", ""links"": {""self"": ""https://api.apitube.io/v1/news/industry/34""}}, {""id"": 368, ""name"": ""Biofuels"", ""links"": {""self"": ""https://api.apitube.io/v1/news/industry/368""}}, {""id"": 260, ""name"": ""Record Video"", ""links"": {""self"": ""https://api.apitube.io/v1/news/industry/260""}}, {""id"": 753, ""name"": ""Eco-Friendly Packaging Supports Sustainable"", ""links"": {""self"": ""https://api.apitube.io/v1/news/industry/753""}}, {""id"": 811, ""name"": ""Bus"", ""links"": {""self"": ""https://api.apitube.io/v1/news/industry/811""}}]",,,en,0.06,positive,0,neutral,0.13,positive,"We’re also continuously building new offerings to help creators grow their audiences and better monetize their content on Spotify. Today, we officially launched the Spotify Partner Program, a powerful new monetization system for creators in the U. This dual approach gives creators greater flexibility and control, helping them navigate industry shifts and maintain consistent revenue streams. Users, meanwhile, benefit from enhancements to the viewing experience and a bigger and better catalog of video podcasts, and Premium users are able to watch without interruptions from third-party ads. While a creator’s baked-in sponsorships will remain in episodes, traditional dynamic ads will not interrupt the video for Premium users, creating a seamless viewing experience on any device."
3021217244,2024-12-20T18:12:26Z,"The Spotify Partner Program Is Here, Offering New Ways for Creators to Monetize in the US, UK, Canada, and Australia — Spotify...[Upgrade subscription plan]","With more than 640 million users and more than 250 million subscribers, Spotify is one of the largest platforms in the world for creators. We’re also continuously building new offerings to help creato...[+173 chars]...[Upgrade subscription plan]","The Spotify Partner Program Is Here, Offering New Ways for Creators to Monetize in the US, UK, Canada, and Australia — Spotify News News & Announcements Artists & Creators Culture & Trends Behind the ...[+4063 chars]...[Upgrade subscription plan]","[{""id"": ""IAB3-1"", ""name"": ""Advertising"", ""score"": 0.6, ""taxonomy"": ""iab-qag"", ""links"": {""self"": ""https://api.apitube.io/v1/news/category/iab-qag/IAB3-1""}}, {""id"": ""IAB19-6"", ""name"": ""Cell Phones"", ""score"": 0.4, ""taxonomy"": ""iab-qag"", ""links"": {""self"": ""https://api.apitube.io/v1/news/category/iab-qag/IAB19-6""}}, {""id"": ""IAB19-14"", ""name"": ""Desktop Video"", ""score"": 0.4, ""taxonomy"": ""iab-qag"", ""links"": {""self"": ""https://api.apitube.io/v1/news/category/iab-qag/IAB19-14""}}, {""id"": ""IAB13-9"", ""name"": ""Options"", ""score"": 0.4, ""taxonomy"": ""iab-qag"", ""links"": {""self"": ""https://api.apitube.io/v1/news/category/iab-qag/IAB13-9""}}, {""id"": ""IAB19-34"", ""name"": ""Web Design/HTML"", ""score"": 0.4, ""taxonomy"": ""iab-qag"", ""links"": {""self"": ""https://api.apitube.io/v1/news/category/iab-qag/IAB19-34""}}, {""id"": ""IAB7-25"", ""name"": ""Herbs for Health"", ""score"": 0.4, ""taxonomy"": ""iab-qag"", ""links"": {""self"": ""https://api.apitube.io/v1/news/category/iab-qag/IAB7-25""}}, {""id"": ""IAB8"", ""name"": ""Food & Drink"", ""score"": 0.4, ""taxonomy"": ""iab-qag"", ""links"": {""self"": ""https://api.apitube.io/v1/news/category/iab-qag/IAB8""}}, {""id"": ""IAB9-6"", ""name"": ""Candle & Soap Making"", ""score"": 0.3, ""taxonomy"": ""iab-qag"", ""links"": {""self"": ""https://api.apitube.io/v1/news/category/iab-qag/IAB9-6""}}]","[{""id"": 649, ""name"": ""Press Media"", ""links"": {""self"": ""https://api.apitube.io/v1/news/industry/649""}}, {""id"": 1119, ""name"": ""Display Technology Evolution"", ""links"": {""self"": ""https://api.apitube.io/v1/news/industry/1119""}}, {""id"": 650, ""name"": ""News publications for advertising"", ""links"": {""self"": ""https://api.apitube.io/v1/news/industry/650""}}, {""id"": 34, ""name"": ""Security cameras for"", ""links"": {""self"": ""https://api.apitube.io/v1/news/industry/34""}}, {""id"": 368, ""name"": ""Biofuels"", ""links"": {""self"": ""https://api.apitube.io/v1/news/industry/368""}}, {""id"": 260, ""name"": ""Record Video"", ""links"": {""self"": ""https://api.apitube.io/v1/news/industry/260""}}, {""id"": 753, ""name"": ""Eco-Friendly Packaging Supports Sustainable"", ""links"": {""self"": ""https://api.apitube.io/v1/news/industry/753""}}, {""id"": 811, ""name"": ""Bus"", ""links"": {""self"": ""https://api.apitube.io/v1/news/industry/811""}}]",,,en,0.06,positive,0,neutral,0.13,positive,"We’re also continuously building new offerings to help creators grow their audiences and better monetize their content on Spotify. Today, we officially launched the Spotify Partner Program, a powerful new monetization system for creators in the U. This dual approach gives creators greater flexibility and control, helping them navigate industry shifts and maintain consistent revenue streams. Users, meanwhile, benefit from enhancements to the viewing experience and a bigger and better catalog of video podcasts, and Premium users are able to watch without interruptions from third-party ads. While a creator’s baked-in sponsorships will remain in episodes, traditional dynamic ads will not interrupt the video for Premium users, creating a seamless viewing experience on any device."
