category,datetime,headline,id,image,related,source,summary,url,date
company,1726731300,"Spotify price target raised by $50 at Pivotal Research, here's why",129992595,,SPOT,Thefly.com,Looking for stock market analysis and research with proves results? Zacks.com offers in-depth financial research with over 30years of proven results.,https://finnhub.io/api/news?id=81fdd1e509ef3f75e1272a2f1f93f8b3e880265be833d1b47446b0eb900e4a34,2024-09-19
company,1726707780,Facebook owner Meta and Spotify blast EU decisions on AI,129967558,,SPOT,Alliance News,Looking for stock market analysis and research with proves results? Zacks.com offers in-depth financial research with over 30years of proven results.,https://finnhub.io/api/news?id=5f29d5cee02353c1f94ea87689d68654a14817275ccb67611f9196ece6f4ede4,2024-09-19
company,1726591144,Spotify Technology S A : ‘Mi Primer Escenario’ Offers Emerging Mexican Artists a Chance To Perform at ‘MEXCLA Spotify’,129928254,,SPOT,Finnhub,"Supporting emerging artists is a fundamental part of Spotify's DNA, and we're going one step further with our first-ever music contest in Mexico, Mi Primer Escenario. The contest gives the country's...",https://finnhub.io/api/news?id=ab29b0aa4d4a7fae7bb1ea4239b2581a307ad505afeae13a751000630016476d,2024-09-17
company,1726589406,"Spotify, IBD Stock Of The Day, On Path To 1 Billion Users",129926428,https://media.zenfs.com/en/ibd.com/e479a66c658e87afefcfa096a1f9e8d7,SPOT,Yahoo,"Spotify Technology is on pace to reach 1 billion monthly active users worldwide by 2030, a Wall Street analyst says.",https://finnhub.io/api/news?id=571e83820e24133b87124b72efe071059889db48e98bd51ac237644cc142f157,2024-09-17
company,1726578460,Spotify Technology And 2 Other Stocks Possibly Undervalued,129921501,https://media.zenfs.com/en/simply_wall_st__316/c3b8f04c9585dfd831e5e484e2786362,SPOT,Yahoo,"In a week marked by significant rebounds in U.S. stocks and interest rate adjustments from the European Central Bank, investors are closely examining opportunities amid fluctuating economic indicators. As markets navigate these changes, identifying undervalued stocks becomes crucial for those looking to capitalize on potential growth. Understanding what makes a stock undervalued involves assessing its intrinsic value compared to its current market price, particularly during periods of...",https://finnhub.io/api/news?id=6aae0acc50ac0b8d71884ba01b968716cf3d33dc9fb3e3282d5108583156abb8,2024-09-17
company,1726550738,Spotify Technology S.A. (SPOT): Among Cantor Fitzgerald’s Top Internet Stock Picks,129917123,https://s.yimg.com/ny/api/res/1.2/L1VfzT4mG1Rv4M6zH9u5Cg--/YXBwaWQ9aGlnaGxhbmRlcjt3PTEyMDA7aD02NzM-/https://media.zenfs.com/en/insidermonkey.com/ba8bd44a0ab196b25bfaf9408d49d0db,SPOT,Yahoo,"We recently compiled a list of Cantor Fitzgerald’s Top Internet Stocks: Best Stocks To Buy According To $13.2 Billion Firm. In this article, we are going to take a look at where Spotify Technology S.A. (NYSE:SPOT) stands against Cantor Fitzgerald’s other top Internet stocks. The rise of the internet and its ubiquity in our daily lives […]",https://finnhub.io/api/news?id=8f87b5675ecb79f50f4275930099073a23f6adf81ca68ca5636542f00ae7bafa,2024-09-17
company,1726481700,"The Zacks Analyst Blog Ubiquiti, Spotify, DocuSign, Vertiv and Universal Health",129900318,https://media.zenfs.com/en/zacks.com/a2bfc3cdc53f67632597858764a1125a,SPOT,Yahoo,"Ubiquiti, Spotify, DocuSign, Vertiv and Universal Health are included in this Analyst Blog.",https://finnhub.io/api/news?id=f7de77a2017d74e045a34ab7092afd1747e2914e8248b5f2697738e2d90a299d,2024-09-16
company,1726481040,SPOT January 2027 Options Begin Trading,129909684,,SPOT,Stock Options Channel,Looking for stock market analysis and research with proves results? Zacks.com offers in-depth financial research with over 30years of proven results.,https://finnhub.io/api/news?id=82939ccc1c94ffa68e65fa1f1b9b105f54f85730b058762b875e6bdd3bf47f3f,2024-09-16
company,1726472460,Alphabet To $200? Here Are 10 Top Analyst Forecasts For Monday,129901557,,SPOT,Benzinga,Looking for stock market analysis and research with proves results? Zacks.com offers in-depth financial research with over 30years of proven results.,https://finnhub.io/api/news?id=630f1b9f0e6ca73bdcb362aee692a6f37e70d77ed00f37e05934cb1e8879d615,2024-09-16
company,1726472220,Morgan Stanley Remains a Buy on Spotify Technology SA (SPOT),129909688,,SPOT,TipRanks,Looking for stock market analysis and research with proves results? Zacks.com offers in-depth financial research with over 30years of proven results.,https://finnhub.io/api/news?id=316ffead61578e57347c52774343eb998cf0171a87a26e41301125872270d1a9,2024-09-16
company,1726463820,KeyBanc: Spotfiy (NYSE:SPOT) Can Hit 1B Users,129925027,,SPOT,TipRanks,Looking for stock market analysis and research with proves results? Zacks.com offers in-depth financial research with over 30years of proven results.,https://finnhub.io/api/news?id=4c1fa96211ba6f0d19282fcc44798972c62043d359523c7b79b756c91308c7e0,2024-09-16
company,1726462380,"Spotify can reach 1B monthly users, 400M premium subscribers by end of 2030, KeyBanc says",129909689,,SPOT,Seeking Alpha,Looking for stock market analysis and research with proves results? Zacks.com offers in-depth financial research with over 30years of proven results.,https://finnhub.io/api/news?id=e69d48ab3fa9eee67aabf753bc1d35091686c994f2317f474391a38143fbce81,2024-09-16
company,1726460940,"Spotify price target raised by $20 at KeyBanc, here's why",129909692,,SPOT,Thefly.com,Looking for stock market analysis and research with proves results? Zacks.com offers in-depth financial research with over 30years of proven results.,https://finnhub.io/api/news?id=2d59797953f4b259a8a8688442601eb8179181133b20f374799f69d3dbedef0a,2024-09-16
company,1726451220,KeyBanc Remains a Buy on Spotify Technology SA (SPOT),129909693,,SPOT,TipRanks,Looking for stock market analysis and research with proves results? Zacks.com offers in-depth financial research with over 30years of proven results.,https://finnhub.io/api/news?id=ca0365446d8bdf207ef7d271b109a2ec311a7661576dd9f20735940e3db30640,2024-09-16
company,1726258563,Spotify Looks To Beef Up Audio Service With Videos,129870351,,SPOT,Yahoo,"After conquering the streaming music market, Spotify is looking to broaden its subscription service with video.",https://finnhub.io/api/news?id=d6fa97c33160fa67528f0c895d86a5085f5c431dcf9ebbc428a55fbaeb4d484b,2024-09-13
company,1726250400,Buy 5 Large-Cap Growth Stocks for September on Rate Cut Expectations,129869723,https://media.zenfs.com/en/zacks.com/7ce028601f9284bce08a960290dff901,SPOT,Yahoo,"Investment in growth stocks should be fruitful on rate cut hope. Five growth stocks to be purchased for September are DOCU, SPOT, UI, UHS and VRT.",https://finnhub.io/api/news?id=b665c99e5c66e403dab2f41caed924862394dbc98f2d202bf4d960e087e077d9,2024-09-13
company,1726245605,"Showcases, Subway Cars, and a Speakeasy: Inside the Spotify x Samsung Galaxy Fresh Finds Event in NYC",129869877,,SPOT,Finnhub,"At Spotify, our live experiences are curated cultural moments that get people talking. Earlier this year in Chicago, we proved this to be true when we partnered with Samsung Galaxy to bring our Fresh...",https://finnhub.io/api/news?id=f0c155d1f356be45e4daa69a7b9ebcf4f0d11f2ab8cc22df7d084ef7cef205e8,2024-09-13
company,1726242854,Spotify begins piloting parent-managed accounts for kids on family plans,129870355,"https://techcrunch.com/wp-content/uploads/2024/02/GettyImages-1783835425-crop-e1717409949317.jpg?resize=1200,676",SPOT,Yahoo,"Following the moves of other tech giants, Spotify announced on Friday it's introducing in-app parental controls in the form of ""managed accounts"" for listeners under the age of 13. The new feature will initially be offered as a pilot program for parents or guardians on a Family plan in select markets, including Denmark, New Zealand, and Sweden. Once enabled, parents can manage the account of young listeners on their account by preventing them from watching videos, playing content, or even viewin",https://finnhub.io/api/news?id=bcd18a2746e0fa0e64520892ca26e6abc49652c27245f94e299c2920a42c5974,2024-09-13
company,1726221664,Spotify Technology S A : New ‘Countdown To’ Vodcast Series Kicks Off With Artists Jelly Roll and mgk in Debut Episode,129862072,,SPOT,Finnhub,"As fans patiently await their favorite artists' new album releases, the anticipation often leaves them eager for something in the meantime. With Spotify's first-of-its-kind vodcast series Countdown...",https://finnhub.io/api/news?id=17a95e2037d175d15370baf70f38defc8a5c4b7e0963f58f9a3469191037239c,2024-09-13
company,1726218845,Spotify Technology S A : Pilots New Music Experience for Young Listeners on Family Plans,129861660,,SPOT,Finnhub,"Spotify is committed to bringing the best listening experience to all our users, and that includes parents and families. That's why we've introduced a pilot for a Premium music account for young...",https://finnhub.io/api/news?id=fc608c83f9246bf965727119ecebf77778d9c956c304f83f429c4705ea916a8a,2024-09-13
company,1726218000,"The Zacks Analyst Blog Highlights Micron, Amphenol, Arista Networks, Spotify and Datadog",129860661,https://media.zenfs.com/en/zacks.com/0ac112d5c16fc98d5217d000d65874d4,SPOT,Yahoo,"Micron, Amphenol, Arista Networks, Spotify and Datadog are included in this Analyst Blog.",https://finnhub.io/api/news?id=87020e3357f3c3a7b511c2ffd5ad3155cdcb88bd9e4e0c0ee2357243d625eb8c,2024-09-13
company,1726207200,Spotify: Why We Remain Confident In The Position We've Built,129860230,https://static.seekingalpha.com/cdn/s3/uploads/getty_images/1472030179/image_1472030179.jpg?io=getty-c-w1536,SPOT,SeekingAlpha,"The overall gain since Spotify's IPO is somewhat disappointing. So, why do we remain confident in the position we've built? Find out.",https://finnhub.io/api/news?id=da3a056f35b1314bc5ef58e0ea3288371b59978c6172ce65f571af63ed6be30e,2024-09-13
company,1726146017,Spotify Technology (SPOT) is Attracting Investor Attention: Here is What You Should Know,129853673,https://media.zenfs.com/en/zacks.com/090f58c1efbe3555b861102525e50b39,SPOT,Yahoo,"Recently, Zacks.com users have been paying close attention to Spotify (SPOT). This makes it worthwhile to examine what the stock has in store.",https://finnhub.io/api/news?id=cfc2babbcebdb228d3a5ee28e0243694413fda44b5f93ee237b3baeb20e5496e,2024-09-12
company,1726142340,Buy 5 Beaten Down Tech Stocks of Past Month With Huge Near-Term Upside,129843276,https://media.zenfs.com/en/zacks.com/80c3b0044109952d2ccd07e54852806c,SPOT,Yahoo,"Five beaten-down technology giant of past month with excellent price upside for short term are: MU, ANET, APH, DDOG, SPOT.",https://finnhub.io/api/news?id=aa71189a3d3d2872f9291d8956dff2839049086b53eca3e08c8d6858ca339592,2024-09-12
company,1726133107,Spotify Technology S A : Four Must-Use Spotify Features That Bring You Closer to Your Favorite Artists,129842960,,SPOT,Finnhub,"We know that when fans fall in love with an artist, they can't get enough. So when you want to connect with your favorites on a deeper level, Spotify is your go-to destination. Fans and artists...",https://finnhub.io/api/news?id=ca564bea50bdbfc5f8c403b6336f4ede74055f786d97a94db8dacb08187b46cf,2024-09-12
company,1726110120,Spotify wants video-oriented creators on platform. Bloomberg reports,129867250,,SPOT,Thefly.com,Looking for stock market analysis and research with proves results? Zacks.com offers in-depth financial research with over 30years of proven results.,https://finnhub.io/api/news?id=4e449cbb2a2f0758d20a82847a221ab185cb662394fd7fd32306dbd3f8d8ef64,2024-09-12
company,1726044780,Ad spending expected to shift as economic downturn looms -- analyst,129824395,,SPOT,Seeking Alpha,Looking for stock market analysis and research with proves results? Zacks.com offers in-depth financial research with over 30years of proven results.,https://finnhub.io/api/news?id=21faec719e6301c22319865204b0fac89d981206d3647098c2e6550d94503dd9,2024-09-11
company,1726032960,"Shopify, Spotify added to 'Signature Picks' portfolio at Wells Fargo",129846006,,SPOT,Thefly.com,Looking for stock market analysis and research with proves results? Zacks.com offers in-depth financial research with over 30years of proven results.,https://finnhub.io/api/news?id=51248027e18fbf33e9a33e668cbf6cd57bb210d0849d9575c6534b2ed9c99fcf,2024-09-11
company,1725976380,Prediction: These 2 Phenomenal Stocks Are Set to Soar,129804306,https://g.foolcdn.com/editorial/images/789457/visa-v-stock-market-investment.jpg,SPOT,Yahoo,I'm head over heels about these two stocks.,https://finnhub.io/api/news?id=6813e6b3682f2f1ac315cece1f050023e1550bf8dfb2ecc5d7265725575e7065,2024-09-10
company,1725972300,Rowan Street Q2 2024 Letter,129804199,https://static.seekingalpha.com/cdn/s3/uploads/getty_images/868052824/image_868052824.jpg?io=getty-c-w1536,SPOT,SeekingAlpha,"Rowan Street posted a gain of +26.2% (net of fees) during the first half of 2024, outperforming the S&P 500 Index. Click here to read the full fund letter.",https://finnhub.io/api/news?id=5744e36499c12328a9c40a00285b500204ac34eab3ec60733f759db65af723cb,2024-09-10
company,1725951180,Bipartisan group of attorneys general demand warning label on social media apps,129825856,,SPOT,Thefly.com,Looking for stock market analysis and research with proves results? Zacks.com offers in-depth financial research with over 30years of proven results.,https://finnhub.io/api/news?id=2f57d4de0b12d01c104b3a9d6f84596d92837dc76b4691545a4a009e0f333e8c,2024-09-10
company,1725936420,"AT&T, Amazon, and Spotify among UBS' top TMT stocks for 2024",129808176,,SPOT,Seeking Alpha,Looking for stock market analysis and research with proves results? Zacks.com offers in-depth financial research with over 30years of proven results.,https://finnhub.io/api/news?id=e9ceb029165f243c9a8a9514e7a8ba807ed884e9ae0a9159b983229ac6d4b0c7,2024-09-10
company,1725883264,"‘La Tierra de Música Mexicana’: A Three-Day Celebration of the Genre’s Rich Cultural Heritage With Panels, Performances, and More",129786307,,SPOT,Finnhub,"Across generations and borders, Música Mexicana continues to reach new fans. On Spotify, the genre has experienced unprecedented growth, with global streams up more than 440% since 2018. Several...",https://finnhub.io/api/news?id=3cca240eb53740cdd49b0ee5645e11b3cb3620cbbb95ab101b360f66845c90cc,2024-09-09
company,1725882275,What Makes Spotify (SPOT) a Good Investment?,129784349,https://media.zenfs.com/en/insidermonkey.com/2825e93123661ee897128b3440ef7e2b,SPOT,Yahoo,"Rowan Street Capital, an investment management company, released its second-quarter 2024 investor letter. A copy of the letter can be downloaded here. The fund generated a +26.2% (net of fees) return in the first half of the year surpassing the +15.3% return for the S&P 500 index in the same period. The fund has generated […]",https://finnhub.io/api/news?id=7d5aa2bcaecd3904e16969bbcb322241f3f9de3f62a1293be6aaf8a6bc514194,2024-09-09
company,1725869700,"Zacks Investment Ideas feature highlights: Taiwan, Nvidia, Spotify and AppLovin",129789428,https://media.zenfs.com/en/zacks.com/a2bfc3cdc53f67632597858764a1125a,SPOT,Yahoo,"Taiwan, Nvidia, Spotify and AppLovin have been highlighted in this Investment Ideas article.",https://finnhub.io/api/news?id=ff11b3ac6e70415c1888a16ad9c51334a28b506ae6d284461da65c9d98657809,2024-09-09
company,1725869700,"Zacks Industry Outlook Byrna Technologies, Spotify and Climb Global",129790816,https://media.zenfs.com/en/zacks.com/5c556181e5bfb0d6c6432454ad2defb5,SPOT,Yahoo,"Byrna Technologies, Spotify and Climb Global have been highlighted in this Industry Outlook article.",https://finnhub.io/api/news?id=e39291efe7dbab357523896c6ffcfac683bcb2cfebd36ba31dced92457a494c5,2024-09-09
company,1725786240,Warren Buffett Is Buying Sirius XM Stock. Should You?,129775208,https://g.foolcdn.com/editorial/images/789845/listening-to-music.jpg,SPOT,Yahoo,The stock is down 63% from all-time highs.,https://finnhub.io/api/news?id=bb0972c2af0a6006e41185b42e37dc070a64075652b645fcdfbc52695b6599c9,2024-09-08
company,1725703200,Where the next billion creatives will come from,129763954,,SPOT,Yahoo,"Far from Silicon Valley, new waves of innovation in shopping, streaming, and other technologies are emerging in China, India, Africa, and beyond.",https://finnhub.io/api/news?id=e0f9e020a7608bbc8059cd973ba1e843eb77fdd9074aa1f1dbd3782e25983a4d,2024-09-07
company,1725658784,Man charged for using bots to stream AI-generated songs for $10M in royalties,129755773,https://s.yimg.com/ny/api/res/1.2/baSJ4QomxFLH21sE_9tcSw--/YXBwaWQ9aGlnaGxhbmRlcjt3PTEyMDA7aD02NzU-/https://media.zenfs.com/en/fox_business_text_367/343489332ca6fa12e8be296804fce4cd,SPOT,Yahoo,Federal authorities hit a North Carolina man with charges arising from allegations that he fraudulently earned streaming royalties through a scheme involving bots and AI-generated songs.,https://finnhub.io/api/news?id=7bebbc2f6d22a08fa8881a7ae449e377b78e8ad63c3ec3515ba6ce2550ed90c7,2024-09-06
company,1725627480,3 Stocks to Buy From the Flourishing Technology Services Market,129752860,https://media.zenfs.com/en/zacks.com/ebb8b8a767e89fdab119b9ddef47f7b2,SPOT,Yahoo,"Significant growth since the pandemic, driven by the frequent adoption of remote work and other technological advancements, should help the Zacks Technology Services industry thrive. BYRN, SPOT and CLMB are well-positioned to make the most of the exploding demand.",https://finnhub.io/api/news?id=d0a4c8262d3163e94ac2f69c6caef0f7920d4cf850cf3a40899b475dc68c760f,2024-09-06
company,1725620520,Baillie Gifford Reduces Stake in Staar Surgical Co,129748471,,SPOT,GuruFocus,Looking for stock market analysis and research with proves results? Zacks.com offers in-depth financial research with over 30years of proven results.,https://finnhub.io/api/news?id=23d5fe3fb5429ea368287ca3faed0a5e02146cf4dfde818bd7eec3dc7b97f1f1,2024-09-06
company,1725620400,"3 Strong Tech Stocks to Buy in September: TSM, SPOT, APP",129745150,https://media.zenfs.com/en/zacks.com/b4d26834b9b65b604420e4a5892a0c23,SPOT,Yahoo,"Digging into three Zacks Rank #1 (Strong Buy) technology stocks--Taiwan Semiconductor, Spotify, and AppLovin--that investors might want to buy now in September and hold for long-term upside.",https://finnhub.io/api/news?id=9068d262d7dcf745f0946d2c09af16c170cda16a9020c523cc4d07e55bc285ef,2024-09-06
company,1725610572,Cantor Fitzgerald Initiates Coverage of Spotify Technology (SPOT) with Neutral Recommendation,129741274,,SPOT,Fintel,,https://finnhub.io/api/news?id=22832df76f87571eb2d88a282e70663b1dc932161c80edc9b00b3a03342c5f51,2024-09-06
company,1725610200,AI Streaming Scammer Hits a Sour Note: $10M Fraud Unveiled,129768696,,SPOT,TalkMarkets,Looking for stock market analysis and research with proves results? Zacks.com offers in-depth financial research with over 30years of proven results.,https://finnhub.io/api/news?id=652d7ee43c639345e2340b7f7c169962fcb0490e786e1c7158b0bbd63c369941,2024-09-06
company,1725610200,Cantor Fitzgerald Internet analyst to hold an analyst/industry conference call,129764413,,SPOT,Thefly.com,Looking for stock market analysis and research with proves results? Zacks.com offers in-depth financial research with over 30years of proven results.,https://finnhub.io/api/news?id=757a62d26bb8ceff8dc189b23dd0e6f86636c0097aa1280060e52cbf1883bf11,2024-09-06
company,1725572721,Spotify (SPOT) Stock Moves -0.19%: What You Should Know,129742224,https://media.zenfs.com/en/zacks.com/1154d43aaeb65735a640003549116295,SPOT,Yahoo,"In the closing of the recent trading day, Spotify (SPOT) stood at $328.63, denoting a -0.19% change from the preceding trading day.",https://finnhub.io/api/news?id=024c30f347d150178f27415d55ad9269e197c5f0ce72bdec9c75ff6811dc95c6,2024-09-05
company,1725531060,Russell companies with the lowest tax rates expected to generate $1B in 2025 – GS,129727217,,SPOT,Seeking Alpha,Looking for stock market analysis and research with proves results? Zacks.com offers in-depth financial research with over 30years of proven results.,https://finnhub.io/api/news?id=3c4fd338a772840639813215d48ae6b67f2836c6ae44f26efeddef3a4f18cdb1,2024-09-05
company,1725528900,Fidelity Growth Strategies Fund Q2 2024 Review,129726315,https://static.seekingalpha.com/cdn/s3/uploads/getty_images/1489363303/image_1489363303.jpg?io=getty-c-w1536,SPOT,SeekingAlpha,Fidelity Growth Strategies Fund is a diversified domestic equity strategy with a mid-cap growth orientation.,https://finnhub.io/api/news?id=eec7ad51e5167ef66ae535aa2bdcc269bd5ed7f8132a2a4e8736879c434e3301,2024-09-05
company,1725505380,Americans who have a job are feeling secure. Not so for many who are looking for one,129730278,,SPOT,"Associated Press, The",Looking for stock market analysis and research with proves results? Zacks.com offers in-depth financial research with over 30years of proven results.,https://finnhub.io/api/news?id=4eeadd736cea6205ff843b6a60bc44916e40187b16edee3bf3cb650608d86c94,2024-09-05
company,1725505200,You aren't likely to lose a job in the US but may find it harder to land one,129730279,,SPOT,"Associated Press, The",Looking for stock market analysis and research with proves results? Zacks.com offers in-depth financial research with over 30years of proven results.,https://finnhub.io/api/news?id=78a56a990797234d9a4ed7cc05d29fd2ebe3a437ad408e0ccb67dbf2d455ff9e,2024-09-05
company,1725501180,"Meta Platforms, MercadoLibre, and DoorDash are top Internet picks at Cantor Fitzgerald",129730273,,SPOT,Seeking Alpha,Looking for stock market analysis and research with proves results? Zacks.com offers in-depth financial research with over 30years of proven results.,https://finnhub.io/api/news?id=e9341a2262aa96938d9015904ab3e4a610942aa0733975ce9fd6a8d0b6eaaa6d,2024-09-05
company,1725486621,Spotify (SPOT) Gains As Market Dips: What You Should Know,129722251,https://media.zenfs.com/en/zacks.com/d2f7ed3d1940141716bfd200f5c94c6b,SPOT,Yahoo,"Spotify (SPOT) closed the most recent trading day at $329.25, moving +0.2% from the previous trading session.",https://finnhub.io/api/news?id=657cf254bfb54213cb8fba15424fa4d6e9d88179502906eefda422c21671bb1c,2024-09-04
company,1725453060,Spotify Technology and Lamb Weston have been highlighted as Zacks Bull and Bear of the Day,129711526,https://media.zenfs.com/en/zacks.com/5d091b3e912681bbeabff8c176ea70a1,SPOT,Yahoo,Spotify Technology and Lamb Weston are part of the Zacks Bull and Bear of the Day article.,https://finnhub.io/api/news?id=da1d3ae4b1db140d3c9420512d235d82c921872d99c38622fa25cbb2cd682a2b,2024-09-04
company,1725440400,Bull of the Day: Spotify Technology (SPOT),129712363,https://media.zenfs.com/en/zacks.com/5c556181e5bfb0d6c6432454ad2defb5,SPOT,Yahoo,"Spotify's growth has been stellar, with EPS growing 185% and sales moving 19% higher throughout its latest period.",https://finnhub.io/api/news?id=2bf44814581c3c1609828277757b967f216c377aaf9d4aaf1b5b7849656c5b7e,2024-09-04
company,1725438965,Will Spotify Technology S.A. (SPOT) be Able to Improve its Value Proposition?,129712364,https://media.zenfs.com/en/insidermonkey.com/2825e93123661ee897128b3440ef7e2b,SPOT,Yahoo,"Baron Funds, an investment management firm, released its “Focused Growth Fund” second quarter 2024 investor letter. A copy of the letter can be downloaded here. The fund decreased 0.21% (Institutional Shares) in the second quarter outperforming the Russell 2500 Growth Index’s (the Benchmark) 4.22% decline. It became clear throughout the quarter that the Federal Reserve’s […]",https://finnhub.io/api/news?id=d0135265ee3270bd2381688d1559286b42c531dfbedbcda2e6ec2a702c08699f,2024-09-04
company,1725429784,"Spotify Technology S A : Daylist Is Expanding Into New Markets and Languages, So Here Are 3 Tips To Make the Most of It",129702286,,SPOT,Finnhub,"From sunup to sundown, Spotify's daylistserves up an ever-changing playlist of songs that match your mood as it evolves throughout the day. Since launching a year ago, it has erupted as a fan-favorite...",https://finnhub.io/api/news?id=fc90681bdfa3fb85a2d03e3e069d7d9a7686f83ab79f3792d78648251e3c1530,2024-09-04
company,1725421740,A Closer Look at Spotify Technology's Options Market Dynamics,129717276,,SPOT,Benzinga,Looking for stock market analysis and research with proves results? Zacks.com offers in-depth financial research with over 30years of proven results.,https://finnhub.io/api/news?id=04fafb71540d74d35b7c25c3c1c9e28ae3f1dc21d2e1790b4654883f8bc5b618,2024-09-04
company,1725404400,"Neko Health, the body-scanning AI health startup from Spotify's Daniel Ek, opens in London",129698688,"https://techcrunch.com/wp-content/uploads/2024/09/image-11.png?resize=1200,800",SPOT,Yahoo,"Prevention is better than cure, as the saying goes. Today, a splashy startup that has taken that concept to heart — literally and figuratively — is expanding. Neko Health was co-founded by Spotify’s Daniel Ek and Hjalmar Nilsonne with a mission to improve preventative healthcare with annual full body scans and AI-powered insights that can detect conditions like heart disease and skin cancer. Now, the Swedish company is launching in London, its first city outside of its home market. For £299 and",https://finnhub.io/api/news?id=e6740cd80764dc9587a17fb183269af8b02d672b2debba3e7fe9aa8bbbea5e34,2024-09-03
company,1725421320,"Spotify initiated with neutral view at Cantor Fitzgerald, here's why",129717277,,SPOT,Thefly.com,Looking for stock market analysis and research with proves results? Zacks.com offers in-depth financial research with over 30years of proven results.,https://finnhub.io/api/news?id=6b3a635c6274491d76342277e50b40b432c2852d9341bf0f3cdf0c25c9a39839,2024-09-04
