category,datetime,headline,id,image,related,source,summary,url,date
company,1727736300,Hartford International Growth Fund Q2 2024 Commentary,130150767,https://static.seekingalpha.com/cdn/s3/uploads/getty_images/1487894859/image_1487894859.jpg?io=getty-c-w1536,SPOT,SeekingAlpha,"The Hartford International Growth Fund (I Share) underperformed the MSCI ACWI ex USA
Growth Index during the second quarter of 2024. Click here to read the full commentary.",https://finnhub.io/api/news?id=389b71283fa9343165660c8b2a343f1da021331d525f953136897cf8b2080b18,2024-09-30
company,1727705332,Spotify Recovers After 3-Hour Outage Impacting Thousands of Users,130152882,https://media.zenfs.com/en/Benzinga/8ade71e4c29b2434cb95621a658c4b7e,SPOT,Yahoo,"Spotify Technology SA (NYSE:SPOT) recovered from a close to three-hour-long outage on Sunday. Over 40,000 users reported service disruption at 9:30 pm ET on Sunday, as per Downdetector. Spotify acknowledged the issue and wrote on X, ""We're aware of some issues right now and are checking them out!"" At 11:06 pm ET, Spotify said, ""Everything's looking much better now!"" Everything's looking much better now! Give@SpotifyCares a shout if you still need help. — Spotify Status (@SpotifyStatus) September",https://finnhub.io/api/news?id=91b1e7d3c095ed17dc5ed3b2a86b26fc3ecd034df9a6a0c989c39b6c3ee293f9,2024-09-30
company,1727691005,Spotify Technology S A : Listeners Around the World Are Embracing French-Language Content on Spotify,130137482,,SPOT,Finnhub,"Across music, podcasts, and audiobooks, Spotify listeners are turning toward French-language content. In fact, more than 100 million users worldwide listened to at least one piece of audio content in...",https://finnhub.io/api/news?id=30d456c2f565bb914f9fdc60ab623c6f4c41f33355b39895f26cd62c076862ae,2024-09-30
company,1727676300,Spotify’s Robust Business Outlook and Growth Catalysts Justify a Buy Rating,130139690,,SPOT,TipRanks,Looking for stock market analysis and research with proves results? Zacks.com offers in-depth financial research with over 30years of proven results.,https://finnhub.io/api/news?id=46c57767e4c70ffacac9be6a7bde5804784f54f5732433a4b5dde77840392805,2024-09-30
company,1727666520,This Is What Whales Are Betting On Spotify Technology,130161721,,SPOT,Benzinga,Looking for stock market analysis and research with proves results? Zacks.com offers in-depth financial research with over 30years of proven results.,https://finnhub.io/api/news?id=1a4bf72db11a05ba158fec3e083ef5f7d3af008cc2e1dc5fd8dab8cc4c502919,2024-09-30
company,1727662680,"Noteworthy Monday Option Activity: SPOT, FIVE, PWSC",130161722,,SPOT,Stock Options Channel,Looking for stock market analysis and research with proves results? Zacks.com offers in-depth financial research with over 30years of proven results.,https://finnhub.io/api/news?id=6cce41547248328ff870f844a7a7e3d1e2afec8c20b281ffd4809b1a695b0f7d,2024-09-30
company,1727632413,Music streaming site Spotify temporarily goes down,130130297,https://s.yimg.com/ny/api/res/1.2/vKbmN7RE1X9RSzDCegLEVA--/YXBwaWQ9aGlnaGxhbmRlcjt3PTEyMDA7aD03OTY-/https://media.zenfs.com/en/ap_finance_articles_694/391c1fffd6dc8f9b107f8d7d32b62d4b,SPOT,Yahoo,"The music streaming service Spotify was down temporarily on Sunday, leaving thousands of listeners without access to tunes and podcasts.  More than 40,000 people reported outages with the music platform on downdetector.com, a website that allows users to report problems with popular apps and services.  Responding to the post, Spotify users complained about the outage disrupting workout routines and plans to stream a playlist at a child's birthday party.",https://finnhub.io/api/news?id=770d67cd1f2fd94be31402fed5b6da5f2e54b941995c74e06305afa746c0828e,2024-09-29
company,1727626773,"Spotify back up after outage hits over 40,000 users",130132655,https://media.zenfs.com/en/reuters-finance.com/d621225956cb7d51e09c63ae9a473d5d,SPOT,Yahoo,"""Everything's looking much better now!"" Spotify said in a post on social media platform X.  Spotify did not immediately respond to a Reuters' request for comment seeking the reason behind the outage.",https://finnhub.io/api/news?id=2a301e4c7f38a81d7709a7ae77119e40eaef3f4e4cbae4a4fa9ed5c19b7a767a,2024-09-29
company,1727617980,"Missing a beat, streaming service Spotify is back after a temporary outage",130139691,,SPOT,"Associated Press, The",Looking for stock market analysis and research with proves results? Zacks.com offers in-depth financial research with over 30years of proven results.,https://finnhub.io/api/news?id=4e406d8363cdefd3e0273a42132175dd1a71290d5a739f0e4c99eb2c68be3387,2024-09-29
company,1727612373,"Spotify down for over 40,000 users in the US, Downdetector says",130129512,,SPOT,Finnhub,"Audio streaming platform Spotify was down for thousands of users on Sunday, according to outage tracking website Downdetector.com. Downdetector, which tracks outages through a range of...",https://finnhub.io/api/news?id=24e69e172568c479086225d524809e2643e06a9eceee3d7e2c96ad643fbfd135,2024-09-29
company,1727600580,"Consumer Tech News (Sept 23- Sept 27): OpenAI pitched President Biden For Expansion Of Data Centers, Apple Discontinued iPhone 15 And 13 Models & More",130129637,,SPOT,Benzinga,Looking for stock market analysis and research with proves results? Zacks.com offers in-depth financial research with over 30years of proven results.,https://finnhub.io/api/news?id=df7aee9e4bb2d72dac70095b2e092138c6ee93b5aabccae1a6d709fecdd22521,2024-09-29
company,1727578500,Spotify restores service after brief outage affecting 40K users in US,130139692,,SPOT,Seeking Alpha,Looking for stock market analysis and research with proves results? Zacks.com offers in-depth financial research with over 30years of proven results.,https://finnhub.io/api/news?id=89ec03234ce1cef52f8c836157355a12d9684fb0945d720f944fbdc4670ad7a5,2024-09-29
company,1727384400,Spotify Technology S.A. to Announce Financial Results for Third Quarter 2024,130094819,https://s.yimg.com/ny/api/res/1.2/JWeVPL6YzH7nLrLFUeBglg--/YXBwaWQ9aGlnaGxhbmRlcjt3PTEyMDA7aD0zMjk-/https://media.zenfs.com/en/business-wire.com/e4ae0d7c3a7377e476e17d65301f9339,SPOT,Yahoo,"NEW YORK, September 26, 2024--Spotify Technology S.A. (NYSE: SPOT) will post its third quarter 2024 financial results and deck to shareholders on Tuesday, November 12, 2024 after market close.",https://finnhub.io/api/news?id=1ddd06e343b2352eb93338a99b8d840f7ab292e35d3c2ee3b03fefd8c78a85e7,2024-09-26
company,1727348665,High Insider Ownership Growth Stocks In US For September 2024,130071244,https://media.zenfs.com/en/simply_wall_st__316/41bdd0c670f621394929d5266c5d6c72,SPOT,Yahoo,"As of late September 2024, the U.S. stock market has seen a pullback from recent record highs, with the S&P 500 and Dow Jones Industrial Average closing lower amid investor caution ahead of key economic data releases. This environment underscores the importance of identifying growth companies with high insider ownership, as these stocks often signal strong confidence from those closest to the business. In such a climate, understanding what makes a good stock is crucial. Companies that...",https://finnhub.io/api/news?id=53f4fd4c9aaa0924810aefedbedf3c349eff7031921a4bdc377366c1ee264179,2024-09-26
company,1727344740,November 8th Options Now Available For Spotify Technology (SPOT),130085838,,SPOT,Stock Options Channel,Looking for stock market analysis and research with proves results? Zacks.com offers in-depth financial research with over 30years of proven results.,https://finnhub.io/api/news?id=ac1dbb438998bf98d0bfea30b021d2b420291390eaa8cc0b0ceaf84ba068fafe,2024-09-26
company,1727341200,Here’s what to tell Spotify’s new AI playlist builder to get the best soundtrack for any occasion,130074782,,SPOT,Yahoo,"With Spotify’s AI-powered playlist creator, it can help to get specific, but not too specific.",https://finnhub.io/api/news?id=9d4f838698939ace2e086b2989b883923f24c47345acb3db9fdb02a76a9f68f8,2024-09-26
company,1727334360,Wall Street More Bullish On Meta AI Following Connect Event,130103390,,SPOT,TalkMarkets,Looking for stock market analysis and research with proves results? Zacks.com offers in-depth financial research with over 30years of proven results.,https://finnhub.io/api/news?id=20dc676bf8281244a6ff9c3daa2a3ff4be3f22038f52b96362c565b9a984c772,2024-09-26
company,1727301019,Spotify (SPOT) Increases Despite Market Slip: Here's What You Need to Know,130066817,https://media.zenfs.com/en/zacks.com/03fca48475577988aa4e0db94f484b4e,SPOT,Yahoo,"Spotify (SPOT) concluded the recent trading session at $383.96, signifying a +0.95% move from its prior day's close.",https://finnhub.io/api/news?id=36f8445aebdb4f09568728a0ba0461d700d3a4d560f089b261522ed77e3817e0,2024-09-25
company,1727273880,Spotify Stock on Track for Another Record High,130057154,,SPOT,Yahoo,Shares of Spotify reached a new high on Tuesday after TikTok announced it would shutter its music streatming service.,https://finnhub.io/api/news?id=c0962112153f3080b7d0e903dbede7a8909213451ae864abfcc58db755401a4e,2024-09-25
company,1727256060,TikTok shuttering its music service 'a clear positive' for Spotify - Deutsche Bank,130085839,,SPOT,Seeking Alpha,Looking for stock market analysis and research with proves results? Zacks.com offers in-depth financial research with over 30years of proven results.,https://finnhub.io/api/news?id=299bad075568fde522473f3f50f85044aa26b261f8496ab1782a79cf5d2ef9d8,2024-09-25
company,1727212040,TikTok is shutting down its music streaming business,130046195,https://s.yimg.com/ny/api/res/1.2/9fELg3SiRzaj7aJus_8egg--/YXBwaWQ9aGlnaGxhbmRlcjt3PTEyMDA7aD02NzQ-/https://s.yimg.com/os/creatr-uploaded-images/2024-09/e6413920-7ab8-11ef-badd-ba615012edeb,SPOT,Yahoo,"Bytedance has announced it will be ending its music streaming business, TikTok Music, which was supposed to compete with Spotify (SPOT) and Apple Music (AAPL). The service will shut down on November 28. Users have until the end of October to transfer their playlists to another service. Yahoo Finance Senior Reporter Alexandra Canal discusses the move in the video above. For more expert insight and the latest market action, click here to watch this full episode of Market Domination Overtime. This post was written by Stephanie Mikulich.",https://finnhub.io/api/news?id=cca32721ef7352a5237e331e3a41826529047238a385290a62aa8c36fbb99029,2024-09-24
company,1727210782,Tracking Lone Pine Capital Portfolio - Q2 2024 Update,130048253,https://static.seekingalpha.com/cdn/s3/uploads/getty_images/1143979227/image_1143979227.jpg?io=getty-c-w1536,SPOT,SeekingAlpha,"Lone Pine Capital's 13F portfolio value decreased to $12.33B with holdings reduced to 24. Check out the portfolio's new stakes, stake increases and decreases.",https://finnhub.io/api/news?id=52a4e9794348c9980ef53702473019b8b85a40bbfaaa879512c8590e420fed72,2024-09-24
company,1727209148,Spotify Stock Rises As Streaming Music Rival Exits Business,130046197,https://media.zenfs.com/en/ibd.com/9ae1523db4d459352170eb88cf8975ce,SPOT,Yahoo,Spotify stock rose Tuesday after social media firm TikTok announced that it is ending its rival subscription streaming music service.,https://finnhub.io/api/news?id=a2cad51d5b6cb3578014c901c58313bebe3efb8dbe6747daab1a441bdaecdbb7,2024-09-24
company,1727190243,"TikTok to shutter music streaming business in win for Spotify, Apple",130038859,https://s.yimg.com/ny/api/res/1.2/f9RXlISb4vtK9CRk_IbnjQ--/YXBwaWQ9aGlnaGxhbmRlcjt3PTEyMDA7aD04MDA-/https://s.yimg.com/os/creatr-uploaded-images/2024-07/08041180-4c25-11ef-b4fd-aef7463ca834,SPOT,Yahoo,TikTok will shut down its music streaming service beginning Nov. 28.,https://finnhub.io/api/news?id=f0e2d3499c0407fb305139763f3357a6dfe61bcd5adcb39943d2578567cd4dad,2024-09-24
company,1727200646,Spotify’s AI playlist feature rolls out to the US and more markets,130046201,https://techcrunch.com/wp-content/uploads/2024/09/Spotify-AI-Playlist.png?w=1200,SPOT,Yahoo,"Spotify has expanded the availability of its AI Playlist tool to the U.S., Canada, Ireland, and New Zealand after initially launching it for Premium subscribers in the U.K. and Australia. This feature, currently in beta on Android and iOS devices, allows users to create personalized playlists based on written prompts. For instance, users can enter ""a romantic playlist for date night at home"" and receive a customized selection of songs to match the mood. The playlist can be further refined by add",https://finnhub.io/api/news?id=feb558e9417df2a5150e1becd39b6920cf2b78889a15adfb7a02d791b2133c0f,2024-09-24
company,1727188602,"Spotify expands AI Playlist feature to new markets including US, Canada",130046202,https://media.zenfs.com/en/reuters-finance.com/1ed5bbc870ae9f74aaa95d44c3225380,SPOT,Yahoo,"AI Playlist, which is currently offered in beta, helps subscribers personalize their selection of songs that can be refined via additional text prompts.  Spotify is expanding AI Playlist to fresh markets, including Ireland and New Zealand, in a bid to attract new subscribers by sprucing up its app with AI amid growing competition from rival services by Apple and Amazon.com.  Spotify said the feature, which was launched in the United Kingdom and Australia in April, will not produce results for non-music-related prompts such as current events or specific brands, as it is still in beta.",https://finnhub.io/api/news?id=a8b2e690e78cd4346784708c8cf78de183228883a9b92d7fd8a4c16c68955804,2024-09-24
company,1727184610,Is Spotify (SPOT) a Buy as Wall Street Analysts Look Optimistic?,130046204,https://media.zenfs.com/en/zacks.com/a41b81fe729c761f3f94f42ff348f70c,SPOT,Yahoo,"The average brokerage recommendation (ABR) for Spotify (SPOT) is equivalent to a Buy. The overly optimistic recommendations of Wall Street analysts make the effectiveness of this highly sought-after metric questionable. So, is it worth buying the stock?",https://finnhub.io/api/news?id=a39fdb923ce93e33b93003ce76ebd5964904c7e2e4d47bf6aaa72c5c476deee9,2024-09-24
company,1727179260,Spotify Technology SA (SPOT) Trading 3% Higher on Sep 24,130085840,,SPOT,GuruFocus,Looking for stock market analysis and research with proves results? Zacks.com offers in-depth financial research with over 30years of proven results.,https://finnhub.io/api/news?id=b260bd0a681bd4d15c3b41d3caf1fdcfd04f70218b2ee6cd50829244b2483007,2024-09-24
company,1727176680,The Top Five long crowded stocks in each U.S. sector,130039467,,SPOT,Seeking Alpha,Looking for stock market analysis and research with proves results? Zacks.com offers in-depth financial research with over 30years of proven results.,https://finnhub.io/api/news?id=b5ed78da4dc27180f0c7bad0587e79a1220c443ab97f63997bc25c6c4c0cc4ab,2024-09-24
company,1727175459,Spotify: Paying 29x Operating Profits Makes This A Sound Investment,130038696,https://static.seekingalpha.com/cdn/s3/uploads/getty_images/1048258424/image_1048258424.jpg?io=getty-c-w1536,SPOT,SeekingAlpha,"Spotify continues to be an attractive business with a strong loyal customer base, but its valuation isn't too attractive right now. Learn more on SPOT stock now.",https://finnhub.io/api/news?id=b1475c2e3d1bd680510fc545fbf637d8dd71892f6a530f4f40b4a219a477f683,2024-09-24
company,1727173357,Spotify Technology S.A.: Rewarding its shareholders,130038375,,SPOT,Finnhub,Recent stock market crashes have been as violent as they have been short-lived.,https://finnhub.io/api/news?id=35e1057211d8411708946bb901ea4a3c294e4fb4addbec6c3ce5e934a6e2fdf8,2024-09-24
company,1727170620,2 Magnificent Artificial Intelligence (AI) Stocks to Start Buying Ahead of 2025,130041292,https://g.foolcdn.com/editorial/images/791489/a-person-looking-down-at-a-tablet-device-while-standing-in-a-data-center.jpg,SPOT,Yahoo,"A new year is around the corner, so it's a good time for investors to examine new opportunities.",https://finnhub.io/api/news?id=ceea08acbb094ccae426c00c33a768783809923df2091210b378b0bda799d3a6,2024-09-24
company,1727170200,TikTok to close music-streaming business in November amid tough competition,130046208,https://s.yimg.com/cv/apiv2/social/images/yahoo_default_logo-1200x1200.png,SPOT,Yahoo,"ByteDance's TikTok has announced that it will shut down the TikTok Music streaming service on November 28, which comes as the company has struggled to turn its success in marrying music and videos into a service that could take on the likes of Spotify and Google's YouTube. ""After this date, access to TikTok Music, including login, subscriptions, and all other functionalities, will no longer be available,"" the company said in a notice on its official website. TikTok did not give a reason for clos",https://finnhub.io/api/news?id=bcfd27f4c3e52e1f207b4225089641634b286ae1a92094a7d6e8c184c6ef8bf5,2024-09-24
company,1727168584,"Spotify Technology S A : AI Playlist Is Rolling Out in Beta in the US, Canada, Ireland, and New Zealand—Get Started With These Pro Tips",130037827,,SPOT,Finnhub,"In April, Spotify introduced AI Playlist in beta, providing our Premium subscribers in the U.K. and Australia with another tool to fuel discovery and music curation. Now we're expanding the feature,...",https://finnhub.io/api/news?id=ad31f9f52079ce6880dea3081b660cf8cfa68739e9a6e2ebaace69ff4788e8b2,2024-09-24
company,1727117553,"Dow Jones Leader Visa, Meta Stock, Spotify In Or Near Buy Zones",130026732,,SPOT,Yahoo,"As the stock market looked to add to last week's advance, Dow Jones leader Visa — along with Spotify Technology and Meta Platforms stock — traded in or near buy zones. Among the best stocks in the Dow Jones index, Visa is back below a flat-base entry at 290.",https://finnhub.io/api/news?id=cb7243bdd027670ed30cc3ffb253d97e206d94a71a71a728a6cea1a58d448009,2024-09-23
company,1727115449,"Funds Are Adding Amazon, Spotify And This Networking Stock",130026044,,SPOT,Yahoo,Amazon stock is nearing a buy point of a base. Mutual funds have been adding shares along with two other leading stocks in buy zones.,https://finnhub.io/api/news?id=f12adfe28de039e27746c28b6ef2c5aa1b6c5582014d6ed991ad364515fcf026,2024-09-23
company,1727082900,"Can Alex Cooper and the ""Daddy Gang"" Help Save This Warren Buffett Stock?",130020963,https://g.foolcdn.com/editorial/images/791142/people-headphones.jpg,SPOT,Yahoo,"Cooper and her popular ""Call Her Daddy"" podcast are joining a company in Berkshire Hathaway's stock portfolio.",https://finnhub.io/api/news?id=76a07d70559392ee09765c2e2375cf58c3ffbeb734c7dfce2c44498002aecb0e,2024-09-23
company,1727062200,Overweight quality stocks with positive EPS revisions - MS,130028593,,SPOT,Seeking Alpha,Looking for stock market analysis and research with proves results? Zacks.com offers in-depth financial research with over 30years of proven results.,https://finnhub.io/api/news?id=89fd7b6e2c1ffd5f05b7074a5799372a1a5590a1140a54ce4040a191813936cb,2024-09-23
company,1727061540,Overweight quality stocks with positive EPS revision - MS,130028297,,SPOT,Seeking Alpha,Looking for stock market analysis and research with proves results? Zacks.com offers in-depth financial research with over 30years of proven results.,https://finnhub.io/api/news?id=59a6373224408289ebdf7170f98641f805b32587239688372a344b5302bdb670,2024-09-23
company,1726863534,Spotify Stock Finishes at a Record High After a 10-Day Rally,129994464,https://www.investopedia.com/thmb/jEXjWxHg3Q6TKPaX-qrPqfD6PFI=/1500x0/filters:no_upscale():max_bytes(150000):strip_icc()/INV_SpotifyLogo_GettyImages-1258918424-11e56edd0ec648d2b548f639a39e92b9.jpg,SPOT,Yahoo,"Spotify shares rose for a tenth straight session on Friday, ending the day at their first record close since February 2021.",https://finnhub.io/api/news?id=ebf552dafc14e0ede221c1108f7bd5932f2e5eefc71b0e357ed9a7c6595a683d,2024-09-20
company,1726859697,"Meta Stock, Two Others Break Out To New Highs",129990030,,SPOT,Yahoo,"Meta stock, music streaming provider Spotify and finance stock Interactive Brokers are at a new high after a break out.",https://finnhub.io/api/news?id=f06db560ae79627252a39044be80fefe04d56952466924fde8f21543f5177065,2024-09-20
company,1726844542,Fed Rate Rally Boosts Some But Not All — What Market Cycles Tell Prudent Investors,129984536,https://media.zenfs.com/en/ibd.com/eb1e2fe32d5efbb6c9cad40f0f947ce1,SPOT,Yahoo,The Fed rate decision is spurring some stocks higher — but the fundamentals and this factor are more critical for investors.,https://finnhub.io/api/news?id=8f11773d27313a2bd88088320b21ae58ac360a2b87b0f3139f22ab121372c794,2024-09-20
company,1726827065,Spotify Technology S A : Partnering To Combat the Spread of Violent Content Online,129983666,,SPOT,Finnhub,"At Spotify, our Platform Rulesstrictly prohibit content that promotes terrorism or violent extremism. We take actionon content that violates our Platform Rules, and we work closely with third parties...",https://finnhub.io/api/news?id=021a656381834cc723578166e1758d68ce605a93765d2ae893950fde37c92693,2024-09-20
company,1726811400,Jim Cramer on Spotify Technology S.A. (SPOT): ‘KeyBanc Argued The Music Streaming Giant’s Earnings Power Is Underrated’,129979310,https://s.yimg.com/ny/api/res/1.2/L1VfzT4mG1Rv4M6zH9u5Cg--/YXBwaWQ9aGlnaGxhbmRlcjt3PTEyMDA7aD02NzM-/https://media.zenfs.com/en/insidermonkey.com/ba8bd44a0ab196b25bfaf9408d49d0db,SPOT,Yahoo,"We recently compiled a list titled Jim Cramer’s Top Stock Picks: 10 Stocks with High Potential. In this article, we will have a look at where Spotify Technology S.A. (NYSE:SPOT) ranks among the 10 stocks with high potential. In a recent episode of Mad Money, Jim Cramer explains the current split between tech stocks and […]",https://finnhub.io/api/news?id=1310bb45530fb8c7a6edc7d72ff23541391331a7acfee074734111ec5b7da7e6,2024-09-20
company,1726783304,Tracking Ron Baron's BAMCO Portfolio - Q2 2024 Update,129976670,https://static.seekingalpha.com/cdn/s3/uploads/getty_images/1056792912/image_1056792912.jpg?io=getty-c-w1536,SPOT,SeekingAlpha,"An analysis of BAMCO Inc. and Baron Capital's 13F portfolios shows stake changes in Tesla, Arch Capital, Gartner, and other companies. Read more here.",https://finnhub.io/api/news?id=6b61aaa22c7c9330260c8ee5a799257ea05f0c00ad7694528bbe42b2d8d38815,2024-09-19
company,1726770220,The New Magnificent Seven? These Stocks Not Named Nvidia Clear Buy Points,129968999,,SPOT,Yahoo,"Investors are infatuated with the likes of Nvidia and Tesla. But Arista Networks, GE Aerospace and Spotify are among strong alternatives.",https://finnhub.io/api/news?id=55d1acf38f607e50f2bf6d14d37d50d01042c8e8f4abdc59b9897a47cdcedfaf,2024-09-19
company,1726767360,Spotify Stock Rises 83% Year to Date: Is Your FOMO Warranted?,129969001,https://media.zenfs.com/en/zacks.com/5c556181e5bfb0d6c6432454ad2defb5,SPOT,Yahoo,Let's check out if SPOT is still a compelling option to consider for investors looking to gain exposure to the music-streaming sector.,https://finnhub.io/api/news?id=9315c35df92f9d86f7c087e1fedc79f735b3a5317070c4d05a29abd87fdf7660,2024-09-19
company,1726764424,Spotify Technology S A : Join Author Bella Mackie on a Musical Journey Inspired by Her ‘Darkly Comic’ New Book,129969958,,SPOT,Finnhub,"As many readers will attest, wit and humor make for excellent counterparts to the crime fiction genre. That formula certainly worked for Bella Mackiewhen it came to her 2021 debut bestseller, How to...",https://finnhub.io/api/news?id=e05ca1713eb6e65ff55117c679fdf49d876d6eb2a595e350eb3ff29a3b3b99b4,2024-09-19
company,1726760869,Spotify Stock Hits High Note After Getting Big Price-Target Hike,129966555,https://media.zenfs.com/en/ibd.com/f895bb97e0eaf8a1f68d6fae04765a79,SPOT,Yahoo,Spotify Technology stock surged on Thursday after an analyst raised his price target on the music streamer to the highest on Wall Street.,https://finnhub.io/api/news?id=03cf4e181d309dab2f7fc9d1be5beec9d0bb0c1abe47b2b9570aca63fe228da6,2024-09-19
company,1726746540,Pivotal reiterates 'buy' on Spotify but hikes PT by $50; shares rise,129967553,,SPOT,Seeking Alpha,Looking for stock market analysis and research with proves results? Zacks.com offers in-depth financial research with over 30years of proven results.,https://finnhub.io/api/news?id=dda98c643888bb458ee6f0e5e25ecca3ca5d459bda9f56cfdfb18f03c4e4775a,2024-09-19
company,1726743480,November 15th Options Now Available For Spotify Technology (SPOT),129967554,,SPOT,Stock Options Channel,Looking for stock market analysis and research with proves results? Zacks.com offers in-depth financial research with over 30years of proven results.,https://finnhub.io/api/news?id=39d175c426588acb6027e29fb5ce5832c5c6addc0b7af649ff5a51fc3cd19684,2024-09-19
company,1726740410,High Growth Tech Stocks To Watch In September 2024,129961114,https://media.zenfs.com/en/simply_wall_st__316/4d522452d0da08d8412701a84270533b,SPOT,Yahoo,"The market has climbed 1.0% in the last 7 days and is up 28% over the past 12 months, with earnings forecast to grow by 15% annually. In this dynamic environment, identifying high-growth tech stocks can be crucial for investors looking to capitalize on robust market performance and strong future earnings potential.",https://finnhub.io/api/news?id=9667a27cde4241b9d6890b8ee86dc55b49cb2b0f693d6a480fdd221da60276a0,2024-09-19
company,1726740180,Spotify Technology SA (SPOT) Shares Up 5.64% on Sep 19,129967556,,SPOT,GuruFocus,Looking for stock market analysis and research with proves results? Zacks.com offers in-depth financial research with over 30years of proven results.,https://finnhub.io/api/news?id=51f13213daaa0d353dcd3a1443219c189fd408ac16dc51c2b1ef831e718341b3,2024-09-19
company,1726731300,"Meta, others warn E.U. of risks of missing out on benefits of AI, WSJ reports",129975494,,SPOT,Thefly.com,Looking for stock market analysis and research with proves results? Zacks.com offers in-depth financial research with over 30years of proven results.,https://finnhub.io/api/news?id=7ab915405177a5679f2f367b7ed6ca68b68269c71829a5b23a4b33d7bbf205a3,2024-09-19
